Book Id,Title,Author,Author l-f,Additional Authors,ISBN,ISBN13,My Rating,Average Rating,Publisher,Binding,Number of Pages,Year Published,Original Publication Year,Date Read,Date Added,Bookshelves,Bookshelves with positions,Exclusive Shelf,My Review,Spoiler,Private Notes,Read Count,Recommended For,Recommended By,Owned Copies,Original Purchase Date,Original Purchase Location,Condition,Condition Description,BCID
29579,"Foundation (Foundation, #1)",Isaac Asimov,"Asimov, Isaac",,"=""0553803719""","=""9780553803716""",3,4.17,Bantam,Hardcover,244,2004,1951,2017/08/06,2017/07/29,"2017, book","2017 (#41), book (#157)",read,"Der Anfang sowie viele Passagen gefielen mir sehr gut, einige Zeitabschnitte waren allerdings nicht so unterhaltsam. Interessant das Asimov bei der Wahl der Kommunikationsmedien sich nichts modernes als Papier und Mikrofilm vorstellen konnte.",,,1,,,0,,,,,
33571134,Tilt! Der Jahresrückblick 2016,Urban Priol,"Priol, Urban",,"=""383713668X""","=""9783837136685""",3,4.00,Random House Audio,Audio CD,2,2016,,2017/08/06,2017/08/05,"2017, audiobook","2017 (#42), audiobook (#50)",read,"war okay, dürfte noch ein wenig bissiger sein.",,,1,,,0,,,,,
1701151,Sex ist dem Jakobsweg sein Genitiv. Eine Vermessung. Focus Kolumnen,Harald Schmidt,"Schmidt, Harald",,"=""3462039547""","=""9783462039542""",3,2.97,KiWi-Taschenbuch,Paperback,192,,2007,2017/07/21,2017/06/25,"2017, book","2017 (#39), book (#154)",read,"Schmidt ist bissig, leider eine Focus Kulumne",,,1,,,0,,,,,
9859447,Der kommende Aufstand,Comité invisible,"invisible, Comité",Elmar Schmeda,"=""3894017325""","=""9783894017323""",0,3.79,Edition Nautilus,Paperback,123,2010,2007,,2017/07/12,to-read,to-read (#287),to-read,,,,0,,,0,,,,,
18302278,Warum ich trotzdem Seitensprünge mache,Joseph von Westphalen,"Westphalen, Joseph von",,"=""3453082036""","=""9783453082038""",1,3.00,Heyne,Paperback,181,1995,1995,2017/07/09,2017/05/09,"2017, book","2017 (#31), book (#147)",read,"Ein Buch so angenehm wie eine Zahnwurzelbehandlung. Autor war eine Empfehlung von Jan und Oli, aber die Texte waren das unausgegorenste was ich dieses Jahr gelesen hab. Bis zur letzten Zeile zu lesen eine reine Qual.",,,1,,,0,,,,,
4480073,Warum fällt das Schaf vom Baum?,Christiane Stenger,"Stenger, Christiane",,"=""3453685113""","=""9783453685116""",3,3.58,Heyne Verlag,Paperback,232,2006,2004,2016/05/10,2015/12/17,"2016, book","2016 (#24), book (#37)",read,"gekürzte Hörbuchfassung, hat mir gut gefallen. Werde jetzt nochmal das Buch in die Hand nehmen.",,,1,,,0,,,,,
1966899,Schloss aus Glas,Jeannette Walls,"Walls, Jeannette","Ulrike Wasel, Klaus Timmermann","=""3453351355""","=""9783453351356""",5,4.28,Diana,Paperback,384,2006,2005,2017/06/18,2017/05/25,"2017, book, favorites","2017 (#33), book (#149), favorites (#36)",read,"Habe ab der Hälfte das Buch immer wieder beiseite gelegt. Nicht weil es schlecht ist. Ganz im Gegenteil es war so gut, dass ich einfach nicht damit abschliessen wollte. Seit langem das beste Buch was ich gelesen hab. Bin gespannt ob die Verfilung im Herbst auch nur ansatzweise mithalten kann.",,,1,,,0,,,,,
6093301,Zwischen zwei Träumen,Selim Özdogan,"Özdogan, Selim",,"=""3785716249""","=""9783785716243""",4,3.88,Edition Lübbe,Hardcover,447,2009,2009,2011/12/18,2012/08/02,"book, vor-2012","book (#114), vor-2012 (#44)",read,,,,1,,,0,,,,,
8064790,Los Imposibles: Guia Para Educar A Tus Padres,Joseph von Westphalen,"Westphalen, Joseph von",Johan Devrome,"=""8440696329""","=""9788440696328""",1,2.83,Ediciones B,Hardcover,189,,1999,2017/06/15,2017/05/09,"2017, book","2017 (#36), book (#151)",read,"Autor empfohlen durch Olli und Jan bei fest & flauschig. Buch war eine reine Qual. Weder für Kinder, Jugendliche noch Erwachsene zu empfehlene Zeitverschwendung. Weder clever noch lustig noch in irgendeiner Art und Weise auch nur einen Cent wert.",,,1,,,0,,,,,
16182420,Agonie des Eros,Byung-Chul Han,"Han, Byung-Chul",,"=""""","=""9783882219739""",2,3.95,Matthes & Seitz Berlin,Paperback,69,2011,2017,2017/06/15,2017/06/11,"2017, book","2017 (#37), book (#152)",read,"Zugegeben ich hab dem Buch sicherlich nicht das Hintergrundwissen und die Zeit gegeben die es benötigt. Nachdem ich von den Zeitungsinterview von Byung-Chul Han so begeistert und bestätigt war, war diese Lektüre eher das Gegenteil.",,,1,,,0,,,,,
18302455,The Circle,Dave Eggers,"Eggers, Dave",,"=""""","=""""",3,3.44,Knopf,Hardcover,493,2013,2013,2017/05/30,2017/05/25,"2017, audiobook","2017 (#34), audiobook (#45)",read,"Wirklich starker Anfang er einen auf viele verschiedene spannende Erzählstränge hoffen läßt. Kurz vor dem Ende habe ich dann aber realisiert, dass hier nichts mehr passieren wird. Sehr sehr schade. Da wäre mehr möglich gewesen<br/>Vielleicht lag es daran dass die deutsche Audio Ausgabe gekürzt ist. Who knows",,,1,,,0,,,,,
29101505,"Do Parents Matter?: Why Japanese Babies Sleep Soundly, Mexican Siblings Don’t Fight, and American Families Should Just Relax",Robert A. LeVine,"LeVine, Robert A.",Sarah Levine,"=""1610397231""","=""9781610397230""",0,3.32,PublicAffairs,Hardcover,272,2016,2016,,2017/06/11,to-read,to-read (#285),to-read,,,,0,,,0,,,,,
1032913,A Wild Ride Through the Night,Walter Moers,"Moers, Walter",,"=""0436220547""","=""9780436220548""",0,3.92,"Martin Secker & Warburg, Limited",Hardcover,224,2004,2001,,2017/05/25,to-read,to-read (#284),to-read,,,,0,,,0,,,,,
1491121,Der Fönig,Walter Moers,"Moers, Walter",,"=""345387398X""","=""9783453873988""",4,3.79,Heyne,Taschenbuch,58,2004,2002,2011/01/01,2017/05/25,"vor-2012, audiobook","vor-2012 (#72), audiobook (#47)",read,vom grandiosen Dirk Bach gelesen. Kurz aber super,,,1,,,0,,,,,
62035,"Ensel und Krete. Ein Märchen aus Zamonien (Zamonien, #2)",Walter Moers,"Moers, Walter",,"=""3442450179""","=""""",0,3.73,Goldmann,Paperback,256,2002,2000,,2017/05/25,to-read,to-read (#283),to-read,,,,0,,,0,,,,,
11177312,"Das Labyrinth der Träumenden Bücher (Zamonien, #6)",Walter Moers,"Moers, Walter",,"=""3813503933""","=""9783813503937""",0,3.58,Knaus,Hardcover,432,2011,2011,,2017/05/25,to-read,to-read (#282),to-read,,,,0,,,0,,,,,
1491117,"Der Schrecksenmeister (Zamonien, #5)",Walter Moers,"Moers, Walter",,"=""3492049370""","=""9783492049375""",0,4.19,Piper ,Hardcover,383,2007,2007,,2017/05/25,to-read,to-read (#281),to-read,,,,0,,,0,,,,,
62031,"The City of Dreaming Books (Zamonia, #4)",Walter Moers,"Moers, Walter",J. Maxwell Brownjohn,"=""0099490579""","=""9780099490579""",0,4.37,Vintage,Paperback,461,2007,2004,,2017/05/25,to-read,to-read (#279),to-read,,,,0,,,0,,,,,
62033,"Rumo & His Miraculous Adventures (Zamonia, #3)",Walter Moers,"Moers, Walter",J. Maxwell Brownjohn,"=""1585677256""","=""9781585677252""",0,4.49,Harry N. Abrams,Hardcover,688,2006,2003,,2017/05/25,to-read,to-read (#280),to-read,,,,0,,,0,,,,,
15726731,"Denken hilft zwar, nützt aber nichts",Dan Ariely,"Ariely, Dan",,"=""3426780356""","=""9783426780350""",5,4.11,Knaur,Paperback,448,2010,2008,2011/10/01,2012/08/02,"book, favorites","book (#148), favorites (#35)",read,,,,1,,,0,,,,,
5,"Harry Potter and the Prisoner of Azkaban (Harry Potter, #3)",J.K. Rowling,"Rowling, J.K.",Mary GrandPré,"=""043965548X""","=""9780439655484""",3,4.57,Scholastic Inc.,Mass Market Paperback,435,2004,1999,2017/05/23,2012/09/03,"2017, book, audiobook","2017 (#30), book (#146), audiobook (#44)",read,"Mit dem Buch angefangen, als Hörbuch zuende gehört. Leider sind die deutsche Hörbücher in beiden Fassungen sehr anstrengend.",,,1,,,0,,,,,
1878438,Platon im Striptease-Lokal : Parodien und Travestien,Umberto Eco,"Eco, Umberto",Burkhart Kroeber,"=""""","=""""",3,3.84,Dt. Taschenbuch-Verlag,Paperback,168,1993,1963,2017/05/23,2017/05/22,"2017, book","2017 (#29), book (#145)",read,"Wollte das Buch nach weniger als der Hälfte der Geschichten beiseite legen, als mich der Text ""Das Ding""  packte. Auch die nachfolgenden Texte sind heute, gut 40 bis 50 Jahre nach ihrer Entstehung verständlich und unterhaltsam. Besonders schön war der Satz ""... um einige Koryphäen zu interviewen, die scheint's derzeit voll im Trend liegen."" als Anspielung auf die fülle an ausgewiesenen Experten im Fernsehen (und das im Jahr 1968)",,,1,,,0,,,,,
58696,David Copperfield,Charles Dickens,"Dickens, Charles",Jeremy Tambling,"=""""","=""""",0,4.01,Penguin ,Paperback,882,2004,1849,,2017/05/22,to-read,to-read (#277),to-read,,,,0,,,0,,,,,
3425267,Wie das Denken im Kopf entsteht.,Steven Pinker,"Pinker, Steven",,"=""3463403412""","=""9783463403410""",0,3.98,Kindler Verlag GmbH,Hardcover,767,1998,1997,,2017/05/22,to-read,to-read (#276),to-read,,,,0,,,0,,,,,
28815,Influence: The Psychology of Persuasion,Robert B. Cialdini,"Cialdini, Robert B.",,"=""006124189X""","=""9780061241895""",2,4.18,Harper Business,Paperback,320,2006,1984,2017/05/18,2017/05/17,"2017, audiobook","2017 (#28), audiobook (#43)",read,"Kann den Hype um das Buch nicht ganz verstehen. Liegt vermutlich am alter des Buches. Alle einzelnen Punkte, wie reziprozität, die Studien von Milgram, Pawlowscher Konditionierung, etc.<br/>Auch der Preis für die Deutsche Ausgabe ist super überzogen. Vielleicht ist das neue Buch Pre-Suade besser. ",,,1,,,0,,,,,
11107244,The Better Angels of Our Nature: Why Violence Has Declined,Steven Pinker,"Pinker, Steven",,"=""0670022950""","=""9780670022953""",0,4.12,Viking,Hardcover,802,2011,2010,,2017/05/17,to-read,to-read (#275),to-read,,,,0,,,0,,,,,
29238799,Pre-Suasion: A Revolutionary Way to Influence and Persuade,Robert B. Cialdini,"Cialdini, Robert B.",,"=""1501109790""","=""9781501109799""",0,3.98,Simon  Schuster,Hardcover,432,2016,2016,,2017/05/17,to-read,to-read (#274),to-read,,,,0,,,0,,,,,
1725740,Die Zeitfalte,Madeleine L'Engle,"L'Engle, Madeleine",,"=""3423701277""","=""9783423701273""",3,3.99,Dt. Taschenbuch-Verl.,Paperback,194,1988,1962,2017/05/17,2017/05/12,"2017, book","2017 (#27), book (#144)",read,"Das Buch zog mich bis zur Hälfte in seinen Bann und ich war drauf und dran es in einem Zug zu Ende zu lesen. Leider änderte sich dies ab der Häfte. Nachdem Charles WAllace, Meg und Calvin mit den drei Hexen begannen zu tessern. Das Ende war besonders abrupt und passte meiner Ansicht nicht zu den teilweise deutlich stärker ausgeschmückten Passagen davor (z.B. mit dem Tantentier)<br/>Werde trotzdem Teil zwei lesen.",,,1,,,0,,,,,
32981685,Fast Genial,Benedict Wells,"Wells, Benedict",,"=""""","=""""",0,3.68,,Paperback,336,,2011,,2017/05/14,to-read,to-read (#272),to-read,,,,0,,,0,,,,,
18505796,"10% Happier: How I Tamed the Voice in My Head, Reduced Stress Without Losing My Edge, and Found Self-Help That Actually Works",Dan   Harris,"Harris, Dan",,"=""0062265423""","=""9780062265425""",4,3.91,It Books,Hardcover,256,2014,2014,2015/02/27,2015/01/19,"2015, audiobook, english, favorites","2015 (#20), audiobook (#4), english (#4), favorites (#34)",read,"Habe es als Hörbuch via audble.de gehört. Tolles Buch, das mit der Eso- und Selbsthilfeguru Szene aufräumt. Hat mich auf Meditation und Buddhismus neugierig gemacht.",,,1,,,0,,,,,
6900,Tuesdays with Morrie,Mitch Albom,"Albom, Mitch",,"=""0751529818""","=""9780751529814""",5,4.12,Warner,Paperback,210,2000,1997,2017/02/14,2017/02/12,"2017, book, favorites","2017 (#2), book (#21), favorites (#31)",read,"Empfehlung von Olli Schulz. Lange nicht mehr so schnell und aufmerksam ein Buch gelesen.<br/>Schöne Mischung aus simpler Lebensphilosophie und dem Schmerz des Abschieds durch den Tod.<br/>""Widme dich liebevoll anderen Menschen, widme dich der Gemeinschaft, die dich umgibt, und bemühe dich , etwas zu schaffen, das deinem Leben Sinn und Bedeutung verleiht.""<br/>""Liebt einander oder geht zugrunde.""<br/>""Selbst die, die in unserem Wirtschaftssystem einen Job haben, fühlen sich bedroht, weil sie sich Sorgen machen, ihn zu verlieren. Und wenn du bedroht wirst, dann beginnst du, dich nur noch um dich selbst zu kümmern.""",true,,1,,,0,,,,,
1062387,Neununddreißigneunzig / 39.90,Frédéric Beigbeder,"Beigbeder, Frédéric",,"=""349923324X""","=""9783499233241""",4,3.55,Rowohlt,Paperback,271,2002,2000,,2012/08/15,"book, vor-2012, favorites","book (#69), vor-2012 (#10), favorites (#29)",read,,,,1,,,0,,,,,
13518070,"Die Tage des Gärtners: Vom Glück, im Freien zu sein",Jakob Augstein,"Augstein, Jakob",Nils Hoff,"=""9783446238""","=""""",4,3.38,Carl Hanser Verlag,Hardcover,272,2012,2012,2016/11/17,2016/11/15,"2016, audiobook, favorites","2016 (#6), audiobook (#18), favorites (#27)",read,"Augstein liest das Hörbuch selbst. Zahlreiche Zitate und Anregungen für den heimischen Garten, gute Geschenkidee für Eltern im Ruhestand die sich ernsthaft der Gartenarbeit widmen möchten.",,,1,,,0,,,,,
28665412,"Hinten sind Rezepte drin: Geschichten, die Männern nie passieren würden",Katrin Bauerfeind,"Bauerfeind, Katrin",,"=""3596033969""","=""9783596033966""",4,3.29,FISCHER Taschenbuch,Paperback,224,2016,2016,2016/08/09,2016/08/08,"2016, audiobook, favorites","2016 (#9), audiobook (#20), favorites (#26)",read,"als Hörbuch gehört, super lustig und gut (auch als Mann)",,,1,,,0,,,,,
19213032,Last Exit Babyklappe: Ein Lesespaß für die halbe Familie,Marc-Uwe Kling,"Kling, Marc-Uwe","Kirsten Fuchs, Dagmar Schönleber, Patrick Salmen, Mieze Medusa, Jess Jochimsen, Björn Högsdal, Johanna Wack","=""""","=""""",4,3.00,Satyr,Kindle Edition,192,2013,2013,2016/06/21,2016/06/29,"2016, book, favorites","2016 (#10), book (#28), favorites (#25)",read,Verstehe die schlechte Bewertung des Buchs hier nicht. hatte mit fast jeder Geschichte einen heiden Spaß und kann das Buch nur weiterempfehlen. Werde es als Geschenk im Freundeskreis testen.,,,1,,,0,,,,,
25797100,"Sophia, der Tod und ich",Thees Uhlmann,"Uhlmann, Thees",,"=""3462047930""","=""9783462047936""",5,3.90,Kiepenheuer&Witsch,Hardcover,288,2015,2015,2016/01/23,2016/01/15,"2016, audiobook, favorites","2016 (#22), audiobook (#23), favorites (#23)",read,"Als Hörbuch gelesen vom Autor genossen. Ein fantastische Geschichte von der ersten bis zur letzten Zeile. Oder wie eine der Figuren sagen würde ""toll, toll, toll, schön, schön, schön""<br/>Hoffe auf viele weitere Bücher in den kommenden Jahren. Danke Thees",,,1,,,0,,,,,
25573915,Gegendarstellung,Max Uthoff,"Uthoff, Max",,"=""3837130878""","=""9783837130874""",4,4.33,Random House,Audio CD,2,2015,2015,2015/08/26,2015/08/26,"2015, audiobook, favorites","2015 (#5), audiobook (#26), favorites (#21)",read,"Als Hörbuch gehört. Sehr gute und treffend. An manchen wenigen Stellen ein bisschen zu albern, aber generell sehr zu empfehlen.",,,1,,,0,,,,,
6490389,"Tödliche Spiele (Die Tribute von Panem, #1)",Suzanne Collins,"Collins, Suzanne","Sylke Hachmeister, Peter Klöss, Hauptmann Kompanie","=""3789132187""","=""9783789132186""",5,4.32,Oetinger,Hardcover,416,2009,2008,2013/12/21,2013/11/21,"book, 2013, favorites","book (#48), 2013 (#1), favorites (#20)",read,,,,1,,,0,,,,,
6392654,"Die Känguru-Chroniken: Ansichten eines vorlauten Beuteltiers (Die Känguru-Chroniken, #1)",Marc-Uwe Kling,"Kling, Marc-Uwe",,"=""""","=""9783548372570""",4,4.30,Ullstein,Paperback,271,2009,2009,2013/08/14,2013/09/15,"2013, book, favorites","2013 (#5), book (#50), favorites (#19)",read,,,,1,,,0,,,,,
3312,Schiffbruch mit Tiger,Yann Martel,"Martel, Yann",Manfred Allié,"=""3100478258""","=""9783100478252""",5,3.92,S. Fischer,Hardcover,381,2003,2001,2012/10/10,2012/08/17,"2012, book, favorites","2012 (#7), book (#65), favorites (#18)",read,"Das Buch war toll, von der ersten bis zur letzten Seite eine faszinierende Geschichte. Sie begann anders als erwartet mit dem Leben der Familie Patel in Indien und Pis Glauben sowohl an den Hinduismus, den Islam und das Christentum. Das Leiden auf dem Rettungsboot war gut nachvollziehbar und das Ende mit der alternativen Geschichte für die zwei JApaner vom Verkehrsministerium sehr überraschend.",true,,1,,,0,,,,,
1319677,Soloalbum,Benjamin von Stuckrad-Barre,"Stuckrad-Barre, Benjamin von",,"=""3462034960""","=""9783462034967""",5,3.33,KiWi-Taschenbuch,Paperback,256,2005,1998,,2012/08/15,"book, vor-2012, favorites","book (#82), vor-2012 (#22), favorites (#17)",read,,,,1,,,0,,,,,
47003,Veronika beschließt zu sterben,Paulo Coelho,"Coelho, Paulo",,"=""3257233051""","=""9783257233056""",5,3.71,Diogenes,Paperback,224,2002,1998,,2012/08/11,"vor-2012, book, favorites","vor-2012 (#25), book (#85), favorites (#16)",read,,,,1,,,0,,,,,
10802082,Warum Ich Angst Vor Frauen Habe,Mischa-Sarim Vérollet,"Vérollet, Mischa-Sarim",,"=""3551682402""","=""9783551682406""",4,3.21,Carlsen,Paperback,224,2010,2010,,2012/08/05,"2012, book, favorites","2012 (#12), book (#90), favorites (#15)",read,,,,1,,,0,,,,,
12857835,Geheime Botschaften die Kunst der Verschlüsselung von der Antike bis in die Zeiten des Internet,Simon Singh,"Singh, Simon",Klaus Fritz,"=""3763250670""","=""9783763250677""",5,4.24,Büchergilde Gutenberg,Unknown Binding,475,2000,1999,,2012/08/02,"vor-2012, book, favorites","vor-2012 (#27), book (#94), favorites (#13)",read,,,,1,,,0,,,,,
6471988,Einführung in Perl.,Randal L. Schwartz,"Schwartz, Randal L.","Tom Phoenix, Brian D. Foy","=""3897214342""","=""""",4,3.98,,,,,1993,,2012/08/02,"vor-2012, book, favorites","vor-2012 (#39), book (#108), favorites (#12)",read,,,,1,,,0,,,,,
7557655,Trinkgeld vom Schicksal,Selim Özdogan,"Özdogan, Selim",,"=""3746619173""","=""9783746619170""",5,3.89,Aufbau-Taschenbuch-Verlag,Paperback,222,2003,2003,,2012/08/02,"vor-2012, book, favorites","vor-2012 (#43), book (#113), favorites (#11)",read,,,,1,,,0,,,,,
942188,"Der Schatten des Windes (Der Friedhof der Vergessenen Bücher, #1)",Carlos Ruiz Zafón,"Zafón, Carlos Ruiz",Peter Schwaar,"=""""","=""""",5,4.27,Suhrkamp,Paperback,565,2005,2001,,2012/08/02,"vor-2012, favorites","vor-2012 (#49), favorites (#10)",read,,,,1,,,0,,,,,
1509572,"Wenn das Leben ein Strand ist, sind Frauen das Mehr",Michel Birbæk,"Birbæk, Michel",,"=""3404155017""","=""9783404155019""",4,3.70,Bastei Lübbe,Paperback,429,2004,2004,,2012/08/02,"vor-2012, book, favorites","vor-2012 (#55), book (#124), favorites (#9)",read,,,,1,,,0,,,,,
1509571,"Was mich fertigmacht, ist nicht das Leben, sondern die Tage dazwischen",Michel Birbæk,"Birbæk, Michel",,"=""3404152298""","=""9783404152292""",4,3.82,Bastei Lübbe,Paperback,236,2004,2004,,2012/08/02,"vor-2012, book, favorites","vor-2012 (#56), book (#125), favorites (#8)",read,,,,1,,,0,,,,,
71381,Eine Billion Dollar,Andreas Eschbach,"Eschbach, Andreas",,"=""3785720491""","=""9783785720493""",5,4.08,Bastei Lübbe,Paperback,887,2001,2001,,2012/08/02,"vor-2012, book, favorites","vor-2012 (#60), book (#129), favorites (#6)",read,,,,1,,,0,,,,,
140439,"Macht's gut, und danke für den Fisch (Hitchhiker's Guide to the Galaxy, #4)",Douglas Adams,"Adams, Douglas",Benjamin Schwarz,"=""3453146069""","=""9783453146068""",5,4.09,Heyne,Paperback,188,1999,1984,1998/07/29,2012/08/02,"vor-2012, book, favorites","vor-2012 (#65), book (#134), favorites (#5)",read,,,,1,,,0,,,,,
34757555,Konzentriert arbeiten: Regeln für eine Welt voller Ablenkungen,Cal Newport,"Newport, Cal",Jordan T.A. Wegberg,"=""""","=""""",4,4.18,REDLINE Verlag,Kindle Edition,274,2017,2016,2017/04/19,2017/04/04,"book, 2017, favorites","book (#140), 2017 (#19), favorites (#1)",read,"Konzentriertes Arbeiten ohne Ablenkung, wer träumt nicht davon. Das Buch zeigt verschiedene Wege und Herausforderungen auf dem Weg dahin. Alles mit Quellen belegt. An der ein oder anderen Stelle hätte ich gerne noch ein paar kritische Gegenstandpunkte einfliessen lassen, aber so wie es ist ein super Buch.",,,1,,,0,,,,,
15946768,The School of Life,The School of Life,"Life, The School of","Alain de Botton, Tom Chatfield, John Armstrong","=""1447223721""","=""9781447223726""",0,4.17,MacMillan,Paperback,464,2012,2012,,2017/05/14,to-read,to-read (#271),to-read,,,,0,,,0,,,,,
23421,Kiss & Tell,Alain de Botton,"Botton, Alain de",,"=""0312155611""","=""9780312155612""",0,3.58,Picador,Paperback,258,1997,1994,,2017/05/14,to-read,to-read (#270),to-read,,,,0,,,0,,,,,
292583,On Seeing and Noticing,Alain de Botton,"Botton, Alain de",,"=""0141023074""","=""9780141023076""",0,3.66,Penguin Books Ltd,Paperback,56,2005,2005,,2017/05/14,to-read,to-read (#269),to-read,,,,0,,,0,,,,,
46193,"The Romantic Movement: Sex, Shopping, and the Novel",Alain de Botton,"Botton, Alain de",,"=""0312144032""","=""9780312144036""",0,3.80,Picador,Paperback,336,1996,1994,,2017/05/14,to-read,to-read (#268),to-read,,,,0,,,0,,,,,
17899481,Art as Therapy,Alain de Botton,"Botton, Alain de",John Armstrong,"=""0714865915""","=""9780714865911""",0,4.07,Phaidon Press,Hardcover,240,2013,2013,,2017/05/14,to-read,to-read (#267),to-read,,,,0,,,0,,,,,
26710467,Himmel auf Erden und Hölle im Kopf: Was Sexualität für uns bedeutet,Christoph Joseph Ahlers,"Ahlers, Christoph Joseph",Michael Lissek,"=""""","=""""",0,4.40,Goldmann Verlag,Kindle Edition,449,2015,2015,,2017/05/14,to-read,to-read (#266),to-read,,,,0,,,0,,,,,
6718808,A Week at the Airport: A Heathrow Diary,Alain de Botton,"Botton, Alain de",,"=""1846683599""","=""9781846683596""",0,3.54,Profile Books,Paperback,112,2010,2009,,2017/05/11,to-read,to-read (#265),to-read,,,,0,,,0,,,,,
5293573,The Pleasures and Sorrows of Work,Alain de Botton,"Botton, Alain de",,"=""037542444X""","=""9780375424441""",0,3.63,Pantheon,Hardcover,336,2009,2008,,2017/05/11,to-read,to-read (#264),to-read,,,,0,,,0,,,,,
12576334,Religion for Atheists: A Non-Believer's Guide to the Uses of Religion ,Alain de Botton,"Botton, Alain de",,"=""0241144779""","=""9780241144770""",0,3.63,Hamish Hamilton,Hardcover,320,2012,2011,,2017/05/11,to-read,to-read (#263),to-read,,,,0,,,0,,,,,
23418,The Architecture of Happiness,Alain de Botton,"Botton, Alain de",,"=""0375424431""","=""9780375424434""",0,3.86,Pantheon Books,Hardcover,280,2006,2006,,2017/05/11,to-read,to-read (#262),to-read,,,,0,,,0,,,,,
27845690,The Course of Love,Alain de Botton,"Botton, Alain de",,"=""0241145473""","=""9780241145470""",0,4.04,Hamish Hamilton,Hardcover,240,2016,2016,,2017/05/11,to-read,to-read (#261),to-read,,,,0,,,0,,,,,
23425,Status Anxiety,Alain de Botton,"Botton, Alain de",,"=""0375725350""","=""9780375725357""",0,3.91,Vintage,Paperback,306,2005,2004,,2017/05/11,to-read,to-read (#260),to-read,,,,0,,,0,,,,,
23426,On Love,Alain de Botton,"Botton, Alain de",,"=""0802142400""","=""9780802142405""",0,3.98,Grove Press,Paperback,194,2006,1993,,2017/05/11,to-read,to-read (#259),to-read,,,,0,,,0,,,,,
23419,The Consolations of Philosophy,Alain de Botton,"Botton, Alain de",,"=""""","=""""",0,4.01,Vintage,Paperback,265,2001,2000,,2017/05/11,to-read,to-read (#258),to-read,,,,0,,,0,,,,,
78418,"The Reptile Room (A Series of Unfortunate Events, #2)",Lemony Snicket,"Snicket, Lemony",Brett Helquist,"=""0439206480""","=""9780439206488""",3,3.98,"Scholastic, Inc.",Paperback,192,1999,1999,2017/05/09,2017/05/05,english,english (#5),read,Onkel Monty nimmt die Kinder auf und plant einen Trip nach Peru. Leider kommt Graf Olaf dazwischen. Wie auch schon im ersten Buch mag ich das selbstreferentielle des Autors.,,,1,,,0,,,,,
30688435,Exit West,Mohsin Hamid,"Hamid, Mohsin",,"=""0735212171""","=""9780735212176""",0,3.77,Riverhead,Hardcover,231,2017,2017,,2017/05/08,to-read,to-read (#256),to-read,,,,0,,,0,,,,,
1618,The Curious Incident of the Dog in the Night-Time,Mark Haddon,"Haddon, Mark",,"=""1400032717""","=""9781400032716""",0,3.89,Vintage,Paperback,226,2004,2003,,2017/05/08,to-read,to-read (#255),to-read,,,,0,,,0,,,,,
27151895,Essen erlaubt!,Patric Heizmann,"Heizmann, Patric",,"=""""","=""""",3,3.92,Heyne Verlag,Kindle Edition,225,2015,2015,2017/05/08,2016/05/11,"2017, audiobook","2017 (#26), audiobook (#42)",read,Deutlich angenehmer als das vorherige Hörbuch von Patrick Heinzmann auch wenn einige flache Witze übernommen wurden.,,,1,,,0,,,,,
10644930,11/22/63,Stephen King,"King, Stephen",,"=""1451627289""","=""9781451627282""",0,4.30,Scribner,Hardcover,849,2011,2011,,2017/05/07,to-read,to-read (#254),to-read,,,,0,,,0,,,,,
10964,"Outlander (Outlander, #1)",Diana Gabaldon,"Gabaldon, Diana",,"=""0440242940""","=""9780440242949""",0,4.23,Dell Publishing Company,Mass Market Paperback,850,2005,1991,,2017/05/07,to-read,to-read (#253),to-read,,,,0,,,0,,,,,
78411,"The Bad Beginning (A Series of Unfortunate Events, #1)",Lemony Snicket,"Snicket, Lemony",Brett Helquist,"=""0439206472""","=""9780439206471""",0,3.96,"Scholastic, Inc.",Paperback,176,1999,1999,,2017/05/05,"english, erneut-gelesen","english (#6), erneut-gelesen (#6)",read,,,,1,,,0,,,,,
34887722,Das perfekte Namensgedächtnis: Namen merken mit der 5-Sterne-Methode (Dein Erfolg),Boris Nikolai Konrad,"Konrad, Boris Nikolai","Heiko Grauel, Gisa Bergmann","=""3869362774""","=""9783869362779""",3,3.33,GABAL,Audio CD,,2011,,2017/05/02,2017/04/19,"2017, audiobook","2017 (#24), audiobook (#40)",read,"Loki Methode, Körper Route, alles nett, alles keine Rocket Science",,,1,,,0,,,,,
7592940,Feindesland : Hartmut und ich in Berlin,Oliver Uschmann,"Uschmann, Oliver",,"=""3502110492""","=""9783502110491""",0,3.41,Scherz,,400,2010,2010,,2017/05/02,to-read,to-read (#252),to-read,,,,0,,,0,,,,,
6201758,Murp! Hartmut und ich verzetteln sich,Oliver Uschmann,"Uschmann, Oliver",,"=""3502110506""","=""9783502110507""",0,3.64,Scherz,Paperback,444,2008,2008,,2017/05/02,to-read,to-read (#251),to-read,,,,0,,,0,,,,,
1491280,Voll beschäftigt,Oliver Uschmann,"Uschmann, Oliver",,"=""3596171253""","=""9783596171255""",4,3.98,Fischer-Taschenbuch-Verl.,Paperback,317,2006,2006,,2012/08/02,vor-2012,vor-2012 (#71),read,,,,1,,,0,,,,,
1491279,Hartmut und ich,Oliver Uschmann,"Uschmann, Oliver",,"=""3596166152""","=""9783596166152""",4,3.87,Fischer Taschenbuch,Paperback,240,2005,2005,,2012/08/02,vor-2012,vor-2012 (#70),read,,,,1,,,0,,,,,
1427,The Zahir,Paulo Coelho,"Coelho, Paulo",Margaret Jull Costa,"=""0060832819""","=""9780060832810""",0,3.58,HarperOne,Paperback,336,2006,2005,,2017/04/28,to-read,to-read (#250),to-read,,,,0,,,0,,,,,
